Movie Name,Year of Release,Duration,Genre,IMBD Rating,Director,Cast,Plot
The Shawshank Redemption,1994,2h 22m,['Drama'],9.3,Frank Darabont,"Tim Robbins, Morgan Freeman, Bob Gunton","A Maine banker convicted of the murder of his wife and her lover in 1947 gradually forms a friendship over a quarter century with a hardened convict, while maintaining his innocence and trying to remain hopeful through simple comp..."
The Godfather,1972,2h 55m,"['Crime', 'Drama']",9.2,Francis Ford Coppola,"Marlon Brando, Al Pacino, James Caan","Don Vito Corleone, head of a mafia family, decides to hand over his empire to his youngest son, Michael. However, his decision unintentionally puts the lives of his loved ones in grave danger."
The Dark Knight,2008,2h 32m,"['Action', 'Crime', 'Drama']",9.0,Christopher Nolan,"Christian Bale, Heath Ledger, Aaron Eckhart","When the menace known as the Joker wreaks havoc and chaos on the people of Gotham, Batman, James Gordon and Harvey Dent must work together to put an end to the madness."
The Godfather Part II,1974,3h 22m,"['Crime', 'Drama']",9.0,Francis Ford Coppola,"Al Pacino, Robert De Niro, Robert Duvall","The early life and career of Vito Corleone in 1920s New York City is portrayed, while his son, Michael, expands and tightens his grip on the family crime syndicate."
12 Angry Men,1957,1h 36m,"['Crime', 'Drama']",9.0,Sidney Lumet,"Henry Fonda, Lee J. Cobb, Martin Balsam",The jury in a New York City murder trial is frustrated by a single member whose skeptical caution forces them to more carefully consider the evidence before jumping to a hasty verdict.
Schindler&apos;s List,1994,3h 15m,"['Biography', 'Drama', 'History']",9.0,Steven Spielberg,"Liam Neeson, Ralph Fiennes, Ben Kingsley","In German-occupied Poland during World War II, industrialist Oskar Schindler gradually becomes concerned for his Jewish workforce after witnessing their persecution by the Nazis."
The Lord of the Rings: The Return of the King,2003,3h 21m,"['Action', 'Adventure', 'Drama']",9.0,Peter Jackson,"Elijah Wood, Viggo Mortensen, Ian McKellen",Gandalf and Aragorn lead the World of Men against Sauron&apos;s army to draw his gaze from Frodo and Sam as they approach Mount Doom with the One Ring.
Pulp Fiction,1994,2h 34m,"['Crime', 'Drama']",8.9,Quentin Tarantino,"John Travolta, Uma Thurman, Samuel L. Jackson","The lives of two mob hitmen, a boxer, a gangster and his wife, and a pair of diner bandits intertwine in four tales of violence and redemption."
The Lord of the Rings: The Fellowship of the Ring,2001,2h 58m,"['Action', 'Adventure', 'Drama']",8.9,Peter Jackson,"Elijah Wood, Ian McKellen, Orlando Bloom",A meek Hobbit from the Shire and eight companions set out on a journey to destroy the powerful One Ring and save Middle-earth from the Dark Lord Sauron.
"Il buono, il brutto, il cattivo",1967,2h 58m,"['Adventure', 'Drama', 'Western']",8.8,Sergio Leone,"Clint Eastwood, Eli Wallach, Lee Van Cleef",A bounty hunting scam joins two men in an uneasy alliance against a third in a race to find a fortune in gold buried in a remote cemetery.
Forrest Gump,1994,2h 22m,"['Drama', 'Romance']",8.8,Robert Zemeckis,"Tom Hanks, Robin Wright, Gary Sinise","The history of the United States from the 1950s to the &apos;70s unfolds from the perspective of an Alabama man with an IQ of 75, who yearns to be reunited with his childhood sweetheart."
The Lord of the Rings: The Two Towers,2002,2h 59m,"['Action', 'Adventure', 'Drama']",8.8,Peter Jackson,"Elijah Wood, Ian McKellen, Viggo Mortensen","While Frodo and Sam edge closer to Mordor with the help of the shifty Gollum, the divided fellowship makes a stand against Sauron&apos;s new ally, Saruman, and his hordes of Isengard."
Fight Club,1999,2h 19m,['Drama'],8.8,David Fincher,"Brad Pitt, Edward Norton, Meat Loaf",An insomniac office worker and a devil-may-care soap maker form an underground fight club that evolves into much more.
Inception,2010,2h 28m,"['Action', 'Adventure', 'Sci-Fi']",8.8,Christopher Nolan,"Leonardo DiCaprio, Joseph Gordon-Levitt, Elliot Page","A thief who steals corporate secrets through the use of dream-sharing technology is given the inverse task of planting an idea into the mind of a C.E.O., but his tragic past may doom the project and his team to disaster."
Star Wars: Episode V - The Empire Strikes Back,1980,2h 4m,"['Action', 'Adventure', 'Fantasy']",8.7,Irvin Kershner,"Mark Hamill, Harrison Ford, Carrie Fisher","After the Empire overpowers the Rebel Alliance, Luke Skywalker begins his Jedi training with Yoda. At the same time, Darth Vader and bounty hunter Boba Fett pursue his friends across the galaxy."
The Matrix,1999,2h 16m,"['Action', 'Sci-Fi']",8.7,Lana Wachowski,"Keanu Reeves, Laurence Fishburne, Carrie-Anne Moss","When a beautiful stranger leads computer hacker Neo to a forbidding underworld, he discovers the shocking truth--the life he knows is the elaborate deception of an evil cyber-intelligence."
Goodfellas,1990,2h 25m,"['Biography', 'Crime', 'Drama']",8.7,Martin Scorsese,"Robert De Niro, Ray Liotta, Joe Pesci","The story of Henry Hill and his life in the mafia, covering his relationship with his wife Karen and his mob partners Jimmy Conway and Tommy DeVito."
One Flew Over the Cuckoo&apos;s Nest,1975,2h 13m,['Drama'],8.7,Milos Forman,"Jack Nicholson, Louise Fletcher, Michael Berryman","In the Fall of 1963, a Korean War veteran and criminal pleads insanity and is admitted to a mental institution, where he rallies up the scared patients against the tyrannical nurse."
Interstellar,2014,2h 49m,"['Adventure', 'Drama', 'Sci-Fi']",8.7,Christopher Nolan,"Matthew McConaughey, Anne Hathaway, Jessica Chastain","When Earth becomes uninhabitable in the future, a farmer and ex-NASA pilot, Joseph Cooper, is tasked to pilot a spacecraft, along with a team of researchers, to find a new planet for humans."
Se7en,1995,2h 7m,"['Crime', 'Drama', 'Mystery']",8.6,David Fincher,"Morgan Freeman, Brad Pitt, Kevin Spacey","Two detectives, a rookie and a veteran, hunt a serial killer who uses the seven deadly sins as his motives."
It&apos;s a Wonderful Life,1947,2h 10m,"['Drama', 'Family', 'Fantasy']",8.6,Frank Capra,"James Stewart, Donna Reed, Lionel Barrymore",An angel is sent from Heaven to help a desperately frustrated businessman by showing him what life would have been like if he had never existed.
Shichinin no samurai,1956,3h 27m,"['Action', 'Drama']",8.6,Akira Kurosawa,"Toshirô Mifune, Takashi Shimura, Keiko Tsushima","Farmers from a village exploited by bandits hire a veteran samurai for protection, who gathers six other samurai to join him."
The Silence of the Lambs,1991,1h 58m,"['Crime', 'Drama', 'Thriller']",8.6,Jonathan Demme,"Jodie Foster, Anthony Hopkins, Scott Glenn","A young F.B.I. cadet must receive the help of an incarcerated and manipulative cannibal killer to help catch another serial killer, a madman who skins his victims."
Saving Private Ryan,1998,2h 49m,"['Drama', 'War']",8.6,Steven Spielberg,"Tom Hanks, Matt Damon, Tom Sizemore","Following the Normandy Landings, a group of U.S. soldiers go behind enemy lines to retrieve a paratrooper whose brothers have been killed in action."
Cidade de Deus,2004,2h 10m,"['Crime', 'Drama']",8.6,Fernando Meirelles,"Alexandre Rodrigues, Leandro Firmino, Matheus Nachtergaele","In the slums of Rio, two kids&apos; paths diverge as one struggles to become a photographer and the other a kingpin."
La vita è bella,1997,1h 56m,"['Comedy', 'Drama', 'Romance']",8.6,Roberto Benigni,"Roberto Benigni, Nicoletta Braschi, Giorgio Cantarini","When an open-minded Jewish waiter and his son become victims of the Holocaust, he uses a perfect mixture of will, humor and imagination to protect his son from the dangers around their camp."
The Green Mile,1999,3h 9m,"['Crime', 'Drama', 'Fantasy']",8.6,Frank Darabont,"Tom Hanks, Michael Clarke Duncan, David Morse","A tale set on death row, where gentle giant John Coffey possesses the mysterious power to heal people&apos;s ailments. When the lead guard, Paul Edgecombe, recognizes John&apos;s gift, he tries to help stave off the condemned man&apos;s execution."
Terminator 2: Judgment Day,1991,2h 17m,"['Action', 'Adventure', 'Sci-Fi']",8.6,James Cameron,"Arnold Schwarzenegger, Linda Hamilton, Edward Furlong","A cyborg, identical to the one who failed to kill Sarah Connor, must now protect her ten year old son John from an even more advanced and powerful cyborg."
Star Wars,1977,2h 1m,"['Action', 'Adventure', 'Fantasy']",8.6,George Lucas,"Mark Hamill, Harrison Ford, Carrie Fisher","Luke Skywalker joins forces with a Jedi Knight, a cocky pilot, a Wookiee and two droids to save the galaxy from the Empire&apos;s world-destroying battle station, while also attempting to rescue Princess Leia from the mysterious Darth ..."
Back to the Future,1985,1h 56m,"['Adventure', 'Comedy', 'Sci-Fi']",8.5,Robert Zemeckis,"Michael J. Fox, Christopher Lloyd, Lea Thompson","Marty McFly, a 17-year-old high school student, is accidentally sent 30 years into the past in a time-traveling DeLorean invented by his close friend, the maverick scientist Doc Brown."
Sen to Chihiro no kamikakushi,2003,2h 5m,"['Animation', 'Adventure', 'Family']",8.6,Hayao Miyazaki,"Daveigh Chase, Suzanne Pleshette, Miyu Irino","During her family&apos;s move to the suburbs, a sullen 10-year-old girl wanders into a world ruled by gods, witches and spirits, and where humans are changed into beasts."
The Pianist,2003,2h 30m,"['Biography', 'Drama', 'Music']",8.5,Roman Polanski,"Adrien Brody, Thomas Kretschmann, Frank Finlay","During WWII, acclaimed Polish musician Wladyslaw faces various struggles as he loses contact with his family. As the situation worsens, he hides in the ruins of Warsaw in order to survive."
Gisaengchung,2019,2h 12m,"['Drama', 'Thriller']",8.5,Bong Joon Ho,"Song Kang-ho, Lee Sun-kyun, Cho Yeo-jeong",Greed and class discrimination threaten the newly-formed symbiotic relationship between the wealthy Park family and the destitute Kim clan.
Psycho,1960,1h 49m,"['Horror', 'Mystery', 'Thriller']",8.5,Alfred Hitchcock,"Anthony Perkins, Janet Leigh, Vera Miles",A secretary on the run for embezzlement takes refuge at a secluded California motel owned by a repressed man and his overbearing mother.
Gladiator,2000,2h 35m,"['Action', 'Adventure', 'Drama']",8.5,Ridley Scott,"Russell Crowe, Joaquin Phoenix, Connie Nielsen",A former Roman General sets out to exact vengeance against the corrupt emperor who murdered his family and sent him into slavery.
The Lion King,1994,1h 28m,"['Animation', 'Adventure', 'Drama']",8.5,Roger Allers,"Matthew Broderick, Jeremy Irons, James Earl Jones","Lion prince Simba and his father are targeted by his bitter uncle, who wants to ascend the throne himself."
Spider-Man: Across the Spider-Verse,2023,2h 20m,"['Animation', 'Action', 'Adventure']",8.6,Joaquim Dos Santos,"Shameik Moore, Hailee Steinfeld, Brian Tyree Henry","Miles Morales catapults across the multiverse, where he encounters a team of Spider-People charged with protecting its very existence. When the heroes clash on how to handle a new threat, Miles must redefine what it means to be a ..."
The Departed,2006,2h 31m,"['Crime', 'Drama', 'Thriller']",8.5,Martin Scorsese,"Leonardo DiCaprio, Matt Damon, Jack Nicholson",An undercover cop and a mole in the police attempt to identify each other while infiltrating an Irish gang in South Boston.
Whiplash,2024,1h 46m,"['Drama', 'Music']",8.5,Damien Chazelle,"Miles Teller, J.K. Simmons, Melissa Benoist",A promising young drummer enrolls at a cut-throat music conservatory where his dreams of greatness are mentored by an instructor who will stop at nothing to realize a student&apos;s potential.
American History X,1998,1h 59m,"['Crime', 'Drama']",8.5,Tony Kaye,"Edward Norton, Edward Furlong, Beverly D&apos;Angelo","Living a life marked by violence, neo-Nazi Derek finally goes to prison after killing two black youths. Upon his release, Derek vows to change; he hopes to prevent his brother, Danny, who idolizes Derek, from following in his foot..."
Léon,1994,1h 50m,"['Action', 'Crime', 'Drama']",8.5,Luc Besson,"Jean Reno, Gary Oldman, Natalie Portman","12-year-old Mathilda is reluctantly taken in by Léon, a professional assassin, after her family is murdered. An unusual relationship forms as she becomes his protégée and learns the assassin&apos;s trade."
The Prestige,2006,2h 10m,"['Drama', 'Mystery', 'Sci-Fi']",8.5,Christopher Nolan,"Christian Bale, Hugh Jackman, Scarlett Johansson","After a tragic accident, two stage magicians in 1890s London engage in a battle to create the ultimate illusion while sacrificing everything they have to outwit each other."
Hotaru no haka,1989,1h 28m,"['Animation', 'Drama', 'War']",8.5,Isao Takahata,"Tsutomu Tatsumi, Ayano Shiraishi, Akemi Yamaguchi",A young boy and his little sister struggle to survive in Japan during World War II.
Dune: Part Two,2024,2h 46m,"['Action', 'Adventure', 'Drama']",8.5,Denis Villeneuve,"Timothée Chalamet, Zendaya, Rebecca Ferguson",Paul Atreides unites with Chani and the Fremen while seeking revenge against the conspirators who destroyed his family.
Seppuku,1964,2h 13m,"['Action', 'Drama', 'Mystery']",8.6,Masaki Kobayashi,"Tatsuya Nakadai, Akira Ishihama, Shima Iwashita","When a ronin requesting seppuku at a feudal lord&apos;s palace is told of the brutal suicide of another ronin who previously visited, he reveals how their pasts are intertwined - and in doing so challenges the clan&apos;s integrity."
The Usual Suspects,1995,1h 46m,"['Crime', 'Drama', 'Mystery']",8.5,Bryan Singer,"Kevin Spacey, Gabriel Byrne, Chazz Palminteri",The sole survivor of a pier shoot-out tells the story of how a notorious criminal influenced the events that began with five criminals meeting in a seemingly random police lineup.
Casablanca,1943,1h 42m,"['Drama', 'Romance', 'War']",8.5,Michael Curtiz,"Humphrey Bogart, Ingrid Bergman, Paul Henreid",A cynical expatriate American cafe owner struggles to decide whether or not to help his former lover and her fugitive husband escape the Nazis in French Morocco.
Intouchables,2011,1h 52m,"['Comedy', 'Drama']",8.5,Olivier Nakache,"François Cluzet, Omar Sy, Anne Le Ny","After he becomes a quadriplegic from a paragliding accident, an aristocrat hires a young man from the projects to be his caregiver."
Nuovo Cinema Paradiso,1990,2h 54m,"['Drama', 'Romance']",8.5,Giuseppe Tornatore,"Philippe Noiret, Enzo Cannavale, Antonella Attili","Salvatore, a famous film director, returns to his hometown for the funeral of the local theater&apos;s film projectionist, Alfredo. He reminisces about his life as a young boy falling in love with cinema."
Modern Times,1936,1h 27m,"['Comedy', 'Drama', 'Romance']",8.5,Charles Chaplin,"Charles Chaplin, Paulette Goddard, Henry Bergman",The Tramp struggles to live in modern industrial society with the help of a young homeless woman.
Alien,1979,1h 57m,"['Horror', 'Sci-Fi']",8.5,Ridley Scott,"Sigourney Weaver, Tom Skerritt, John Hurt","After investigating a mysterious transmission of unknown origin, the crew of a commercial spacecraft encounters a deadly lifeform."
Rear Window,1954,1h 52m,"['Mystery', 'Thriller']",8.5,Alfred Hitchcock,"James Stewart, Grace Kelly, Wendell Corey","A house and wheelchair-bound photographer, his fashion model girlfriend and his visiting Nurse spy on neighbors from his courtyard window. Despite skepticism by his PD Detective friend, they&apos;re convinced one of his neighbors is a ..."
C&apos;era una volta il West,1969,2h 46m,"['Drama', 'Western']",8.5,Sergio Leone,"Henry Fonda, Charles Bronson, Claudia Cardinale",A mysterious stranger with a harmonica joins forces with a notorious desperado to protect a beautiful widow from a ruthless assassin working for the railroad.
City Lights,1931,1h 27m,"['Comedy', 'Drama', 'Romance']",8.5,Charles Chaplin,"Charles Chaplin, Virginia Cherrill, Florence Lee","With the aid of a wealthy erratic tippler, a dewy-eyed tramp who has fallen in love with a sightless flower girl accumulates money to be able to help her medically."
Django Unchained,2012,2h 45m,"['Comedy', 'Drama', 'Western']",8.5,Quentin Tarantino,"Jamie Foxx, Christoph Waltz, Leonardo DiCaprio","With the help of a German bounty-hunter, a freed slave sets out to rescue his wife from a brutal plantation owner in Mississippi."
Apocalypse Now,1979,2h 27m,"['Drama', 'Mystery', 'War']",8.4,Francis Ford Coppola,"Martin Sheen, Marlon Brando, Robert Duvall",A U.S. Army officer serving in Vietnam is tasked with assassinating a renegade Special Forces Colonel who sees himself as a god.
Memento,2001,1h 53m,"['Mystery', 'Thriller']",8.4,Christopher Nolan,"Guy Pearce, Carrie-Anne Moss, Joe Pantoliano","Leonard Shelby, an insurance investigator, suffers from anterograde amnesia and uses notes and tattoos to hunt for the man he thinks killed his wife, which is the last thing he remembers."
WALL·E,2008,1h 38m,"['Animation', 'Adventure', 'Family']",8.4,Andrew Stanton,"Ben Burtt, Elissa Knight, Jeff Garlin","A robot who is responsible for cleaning a waste-covered Earth meets another robot and falls in love with her. Together, they set out on a journey that will alter the fate of mankind."
Raiders of the Lost Ark,1981,1h 55m,"['Action', 'Adventure']",8.4,Steven Spielberg,"Harrison Ford, Karen Allen, Paul Freeman","In 1936, archaeologists and adventurers of the U.S. government hired Indiana Jones to find the Ark of the Covenant before the Nazis could obtain its extraordinary powers."
12th Fail,2023,2h 27m,"['Biography', 'Drama']",8.9,Vidhu Vinod Chopra,"Vikrant Massey, Medha Shankr, Anant Joshi",The real-life story of IPS Officer Manoj Kumar Sharma and IRS Officer Shraddha Joshi.
Das Leben der Anderen,2007,2h 17m,"['Drama', 'Mystery', 'Thriller']",8.4,Florian Henckel von Donnersmarck,"Ulrich Mühe, Martina Gedeck, Sebastian Koch","In 1984 East Berlin, an agent of the secret police conducting surveillance on a writer and his lover finds himself becoming increasingly absorbed by their lives."
Sunset Blvd.,1950,1h 50m,"['Drama', 'Film-Noir']",8.4,Billy Wilder,"William Holden, Gloria Swanson, Erich von Stroheim",A screenwriter develops a dangerous relationship with a faded film star determined to make a triumphant return.
Avengers: Infinity War,2018,2h 29m,"['Action', 'Adventure', 'Sci-Fi']",8.4,Anthony Russo,"Robert Downey Jr., Chris Hemsworth, Mark Ruffalo",The Avengers and their allies must be willing to sacrifice all in an attempt to defeat the powerful Thanos before his blitz of devastation and ruin puts an end to the universe.
Paths of Glory,1957,1h 28m,"['Drama', 'War']",8.4,Stanley Kubrick,"Kirk Douglas, Ralph Meeker, Adolphe Menjou","After a failed attack on a German position, a general orders three soldiers, chosen at random, court-martialed for cowardice and their commanding officer must defend them."
Spider-Man: Into the Spider-Verse,2018,1h 57m,"['Animation', 'Action', 'Adventure']",8.4,Bob Persichetti,"Shameik Moore, Jake Johnson, Hailee Steinfeld",Teen Miles Morales becomes the Spider-Man of his universe and must join with five spider-powered individuals from other dimensions to stop a threat for all realities.
Witness for the Prosecution,1958,1h 56m,"['Crime', 'Drama', 'Mystery']",8.4,Billy Wilder,"Tyrone Power, Marlene Dietrich, Charles Laughton",A veteran British barrister must defend his client in a murder trial that has surprise after surprise.
The Shining,1980,2h 26m,"['Drama', 'Horror']",8.4,Stanley Kubrick,"Jack Nicholson, Shelley Duvall, Danny Lloyd","A family heads to an isolated hotel for the winter, where a sinister presence influences the father into violence. At the same time, his psychic son sees horrifying forebodings from both the past and the future."
The Great Dictator,1941,2h 5m,"['Comedy', 'Drama', 'War']",8.4,Charles Chaplin,"Charles Chaplin, Paulette Goddard, Jack Oakie",Dictator Adenoid Hynkel tries to expand his empire while a poor Jewish barber tries to avoid persecution from Hynkel&apos;s regime.
Aliens,1986,2h 17m,"['Action', 'Adventure', 'Sci-Fi']",8.4,James Cameron,"Sigourney Weaver, Michael Biehn, Carrie Henn","Decades after surviving the Nostromo incident, Ellen Ripley is sent out to re-establish contact with a terraforming colony but finds herself battling the Alien Queen and her offspring."
Inglourious Basterds,2009,2h 33m,"['Adventure', 'Drama', 'War']",8.4,Quentin Tarantino,"Brad Pitt, Diane Kruger, Eli Roth","In Nazi-occupied France during World War II, a plan to assassinate Nazi leaders by a group of Jewish U.S. soldiers coincides with a theatre owner&apos;s vengeful plans for the same."
The Dark Knight Rises,2012,2h 44m,"['Action', 'Drama', 'Thriller']",8.4,Christopher Nolan,"Christian Bale, Tom Hardy, Anne Hathaway","Bane, an imposing terrorist, attacks Gotham City and disrupts its eight-year-long period of peace. This forces Bruce Wayne to come out of hiding and don the cape and cowl of Batman again."
Coco,2017,1h 45m,"['Animation', 'Adventure', 'Drama']",8.4,Lee Unkrich,"Anthony Gonzalez, Gael García Bernal, Benjamin Bratt","Aspiring musician Miguel, confronted with his family&apos;s ancestral ban on music, enters the Land of the Dead to find his great-great-grandfather, a legendary singer."
Amadeus,1984,2h 40m,"['Biography', 'Drama', 'Music']",8.4,Milos Forman,"F. Murray Abraham, Tom Hulce, Elizabeth Berridge","The life, success and troubles of Wolfgang Amadeus Mozart, as told by Antonio Salieri, the contemporaneous composer who was deeply jealous of Mozart&apos;s talent and claimed to have murdered him."
Dr. Strangelove or: How I Learned to Stop Worrying and Love the Bomb,1964,1h 35m,"['Comedy', 'War']",8.3,Stanley Kubrick,"Peter Sellers, George C. Scott, Sterling Hayden","An unhinged American general orders a bombing attack on the Soviet Union, triggering a path to nuclear holocaust that a war room full of politicians and generals frantically tries to stop."
Toy Story,1995,1h 21m,"['Animation', 'Adventure', 'Comedy']",8.3,John Lasseter,"Tom Hanks, Tim Allen, Don Rickles",A cowboy doll is profoundly threatened and jealous when a new spaceman action figure supplants him as top toy in a boy&apos;s bedroom.
Oldeuboi,2003,N/A,"['Action', 'Drama', 'Mystery']",8.3,Park Chan-wook,"Choi Min-sik, Yoo Ji-tae, Kang Hye-jeong","After being kidnapped and imprisoned for fifteen years, Oh Dae-Su is released, only to find that he must track down his captor in five days."
American Beauty,1999,2h 2m,['Drama'],8.3,Sam Mendes,"Kevin Spacey, Annette Bening, Thora Birch",A sexually frustrated suburban father has a mid-life crisis after becoming infatuated with his daughter&apos;s best friend.
Avengers: Endgame,2019,3h 1m,"['Action', 'Adventure', 'Drama']",8.4,Anthony Russo,"Robert Downey Jr., Chris Evans, Mark Ruffalo","After the devastating events of Avengers: Infinity War (2018), the universe is in ruins. With the help of remaining allies, the Avengers assemble once more in order to reverse Thanos&apos; actions and restore balance to the universe."
Braveheart,1995,2h 58m,"['Biography', 'Drama', 'War']",8.3,Mel Gibson,"Mel Gibson, Sophie Marceau, Patrick McGoohan",Scottish warrior William Wallace leads his countrymen in a rebellion to free his homeland from the tyranny of King Edward I of England.
Das Boot,1982,2h 29m,"['Drama', 'War']",8.4,Wolfgang Petersen,"Jürgen Prochnow, Herbert Grönemeyer, Klaus Wennemann",A German U-boat stalks the frigid waters of the North Atlantic as its young crew experience the sheer terror and claustrophobic life of a submariner in World War II.
Good Will Hunting,1998,2h 6m,"['Drama', 'Romance']",8.3,Gus Van Sant,"Robin Williams, Matt Damon, Ben Affleck","Will Hunting, a janitor at MIT, has a gift for mathematics, but needs help from a psychologist to find direction in his life."
Mononoke-hime,1997,2h 14m,"['Animation', 'Action', 'Adventure']",8.3,Hayao Miyazaki,"Yôji Matsuda, Yuriko Ishida, Yûko Tanaka","On a journey to find the cure for a Tatarigami&apos;s curse, Ashitaka finds himself in the middle of a war between the forest gods and Tatara, a mining colony. In this quest he also meets San, the Mononoke Hime."
Joker,2019,2h 2m,"['Crime', 'Drama', 'Thriller']",8.4,Todd Phillips,"Joaquin Phoenix, Robert De Niro, Zazie Beetz","Arthur Fleck, a party clown and a failed stand-up comedian, leads an impoverished life with his ailing mother. However, when society shuns him and brands him as a freak, he decides to embrace the life of crime and chaos in Gotham ..."
Kimi no na wa.,2017,1h 46m,"['Animation', 'Drama', 'Fantasy']",8.4,Makoto Shinkai,"Ryunosuke Kamiki, Mone Kamishiraishi, Ryo Narita","Two teenagers share a profound, magical connection upon discovering they are swapping bodies. Things manage to become even more complicated when the boy and girl decide to meet in person."
Tengoku to jigoku,1963,2h 23m,"['Crime', 'Drama', 'Mystery']",8.4,Akira Kurosawa,"Toshirô Mifune, Yutaka Sada, Tatsuya Nakadai",An executive of a Yokohama shoe company becomes a victim of extortion when his chauffeur&apos;s son is kidnapped by mistake and held for ransom.
3 Idiots,2009,2h 50m,"['Comedy', 'Drama']",8.4,Rajkumar Hirani,"Aamir Khan, Madhavan, Mona Singh","Two friends are searching for their long lost companion. They revisit their college days and recall the memories of their friend who inspired them to think differently, even as the rest of the world called them &quot;idiots&quot;."
Once Upon a Time in America,1984,3h 49m,"['Crime', 'Drama']",8.3,Sergio Leone,"Robert De Niro, James Woods, Elizabeth McGovern","A former Prohibition-era Jewish gangster returns to the Lower East Side of Manhattan 35 years later, where he must once again confront the ghosts and regrets of his old life."
